{
  "approval_id": "appr-4f9fc671",
  "approver": {
    "display_name": "Pilot Validation Team",
    "org": "Bazari Enterprise",
    "role": "Tech Lead"
  },
  "decision": "approve",
  "episode_id": "change-7e8adef6",
  "reason": "Pilot Episode B - SLA tracking feature approved. Change Request CR-SLA-001 adds sla_deadline field to Ticket and CheckSLABreach use case. Impact Gate passed. Backward compatible change.",
  "schema_version": "approval.v1",
  "scope": {
    "what": "release"
  },
  "signatures": [
    {
      "scheme": "manual"
    }
  ],
  "volatile": {
    "timestamp": "2026-01-08T21:48:00.109663Z"
  }
}